{
  "$schema": "../../schema/theme.schema.json",
  "name": "sakura-dawn",
  "displayName": "樱晨 Sakura Dawn",
  "kind": "light",
  "description": "带一点粉调的晨光白，柔和、有温度。",
  "terminal": {
    "background": "#FCF7F7",
    "foreground": "#40353A",
    "cursor": "#B8566F",
    "cursorAccent": "#FCF7F7",
    "selectionBackground": "#F3DCE2",
    "black": "#40353A",
    "red": "#B03A3F",
    "green": "#4A7337",
    "yellow": "#8C6312",
    "blue": "#4A5FA8",
    "magenta": "#A0457A",
    "cyan": "#2A7377",
    "white": "#958A8E",
    "brightBlack": "#90848A",
    "brightRed": "#BE4A4E",
    "brightGreen": "#537C40",
    "brightYellow": "#936A18",
    "brightBlue": "#566BB3",
    "brightMagenta": "#AC5286",
    "brightCyan": "#327B7F",
    "brightWhite": "#978B8F"
  },
  "ui": {
    "surface0": "#FCF7F7",
    "surface1": "#F6EEEF",
    "surface2": "#EEE3E5",
    "border": "#E5D7DA",
    "text": "#352C30",
    "textMuted": "#716268",
    "accent": "#B8566F",
    "accentSoft": "#F5E1E6",
    "onAccent": "#FFFFFF",
    "success": "#4A7337",
    "warning": "#8C6312",
    "danger": "#B03A3F"
  }
}
