{
  "$schema": "../../schema/theme.schema.json",
  "name": "night-voyage",
  "displayName": "夜航 Night Voyage",
  "kind": "dark",
  "description": "配套的深色主题，晚上切换用，和浅色主题共用同一套强调色思路。",
  "terminal": {
    "background": "#1E2128",
    "foreground": "#D9DCE3",
    "cursor": "#8EA6E0",
    "cursorAccent": "#1E2128",
    "selectionBackground": "#36405A",
    "black": "#686E79",
    "red": "#E8857C",
    "green": "#9CCB86",
    "yellow": "#E3C07A",
    "blue": "#97B4EB",
    "magenta": "#C79AE0",
    "cyan": "#7CC4C6",
    "white": "#C9CDD6",
    "brightBlack": "#7A8194",
    "brightRed": "#F09A92",
    "brightGreen": "#B0D89C",
    "brightYellow": "#EDCF92",
    "brightBlue": "#9DBAF0",
    "brightMagenta": "#D4AEEA",
    "brightCyan": "#93D2D4",
    "brightWhite": "#EEF0F4"
  },
  "ui": {
    "surface0": "#1E2128",
    "surface1": "#242832",
    "surface2": "#2D323E",
    "border": "#3A404E",
    "text": "#E6E8EE",
    "textMuted": "#A3A9B6",
    "accent": "#8EA6E0",
    "accentSoft": "#2E3850",
    "onAccent": "#141720",
    "success": "#9CCB86",
    "warning": "#E3C07A",
    "danger": "#E8837A"
  }
}
