{
  "$schema": "../../schema/theme.schema.json",
  "name": "celadon",
  "displayName": "青瓷 Celadon",
  "kind": "light",
  "description": "淡青灰绿，安静克制，适合长时间编码。",
  "terminal": {
    "background": "#F4F7F4",
    "foreground": "#2E3A34",
    "cursor": "#3F7F64",
    "cursorAccent": "#F4F7F4",
    "selectionBackground": "#D7E6DD",
    "black": "#2E3A34",
    "red": "#AC3F3A",
    "green": "#2A6331",
    "yellow": "#7D6512",
    "blue": "#335F9E",
    "magenta": "#80508F",
    "cyan": "#1D6F70",
    "white": "#555E59",
    "brightBlack": "#7E8A83",
    "brightRed": "#B94C46",
    "brightGreen": "#306737",
    "brightYellow": "#856C18",
    "brightBlue": "#3F6BAA",
    "brightMagenta": "#8C5C9B",
    "brightCyan": "#267A7B",
    "brightWhite": "#8D9890"
  },
  "ui": {
    "surface0": "#F4F7F4",
    "surface1": "#EBF0EC",
    "surface2": "#E0E8E2",
    "border": "#D3DDD6",
    "text": "#26312B",
    "textMuted": "#5B6961",
    "accent": "#3F7F64",
    "accentSoft": "#DCEAE2",
    "onAccent": "#FFFFFF",
    "success": "#2F7046",
    "warning": "#7F6612",
    "danger": "#AC3F3A"
  }
}
