{
  "$schema": "../../schema/theme.schema.json",
  "name": "moon-paper",
  "displayName": "月白 Moon Paper",
  "kind": "light",
  "description": "暖调纸白，默认主题。像在米色稿纸上写字，长时间看不累。",
  "terminal": {
    "background": "#FAF8F3",
    "foreground": "#3A3833",
    "cursor": "#5B6FA8",
    "cursorAccent": "#FAF8F3",
    "selectionBackground": "#DCE3F2",
    "black": "#3A3833",
    "red": "#B23A2E",
    "green": "#3E7330",
    "yellow": "#886310",
    "blue": "#4C34A8",
    "magenta": "#8A4A9C",
    "cyan": "#1F7478",
    "white": "#605D56",
    "brightBlack": "#8A867C",
    "brightRed": "#C04937",
    "brightGreen": "#497D37",
    "brightYellow": "#8E6A16",
    "brightBlue": "#5841B0",
    "brightMagenta": "#9654A8",
    "brightCyan": "#28797E",
    "brightWhite": "#9A968D"
  },
  "ui": {
    "surface0": "#FAF8F3",
    "surface1": "#F2EFE7",
    "surface2": "#E9E5DA",
    "border": "#DEDACD",
    "text": "#2F2D29",
    "textMuted": "#68645A",
    "accent": "#5B6FA8",
    "accentSoft": "#E3E7F3",
    "onAccent": "#FFFFFF",
    "success": "#3E7330",
    "warning": "#8A6410",
    "danger": "#B23A2E"
  }
}
