{
  "$schema": "../../schema/theme.schema.json",
  "name": "frost",
  "displayName": "霜蓝 Frost",
  "kind": "light",
  "description": "冷调蓝灰，清爽干净，适合白天和明亮环境。",
  "terminal": {
    "background": "#F5F8FB",
    "foreground": "#2B3340",
    "cursor": "#2F6FB0",
    "cursorAccent": "#F5F8FB",
    "selectionBackground": "#D6E4F3",
    "black": "#2B3340",
    "red": "#B03A48",
    "green": "#2F7552",
    "yellow": "#83650F",
    "blue": "#2A30A8",
    "magenta": "#7D4FA6",
    "cyan": "#146165",
    "white": "#565E69",
    "brightBlack": "#808A97",
    "brightRed": "#BB4955",
    "brightGreen": "#387C5A",
    "brightYellow": "#896C16",
    "brightBlue": "#3A3EB4",
    "brightMagenta": "#8A5BB2",
    "brightCyan": "#1A666B",
    "brightWhite": "#8E97A2"
  },
  "ui": {
    "surface0": "#F5F8FB",
    "surface1": "#ECF1F6",
    "surface2": "#E1E8F0",
    "border": "#D5DDE7",
    "text": "#232B36",
    "textMuted": "#5B6776",
    "accent": "#2F6FB0",
    "accentSoft": "#DCE8F5",
    "onAccent": "#FFFFFF",
    "success": "#2F7552",
    "warning": "#85660F",
    "danger": "#B03A48"
  }
}
